event_id_cnty,event_date,year,time_precision,disorder_type,event_type,sub_event_type,actor1,assoc_actor_1,inter1,actor2,assoc_actor_2,inter2,interaction,civilian_targeting,iso,region,country,admin1,admin2,admin3,location,latitude,longitude,geo_precision,source,source_scale,notes,fatalities,tags,timestamp
SRI6029,"31 May 2022",2022,1,Demonstrations,Protests,"Peaceful protest","Protesters (Sri Lanka)","Women (Sri Lanka)",6,,,0,60,,144,"South Asia","Sri Lanka",Northern,Mullaitivu,,Mullaitivu,9.268,80.815,1,Virakesari,National,"On 31 May 2022, North East Women's Union staged a protest in Mullaitivu (Mullaitivu, Northern) over violence against women in children. The protest was sparked following the murder of a nine year old girl who was killed by a man after she refused to perform sexual acts.",0,"crowd size=no report",1680035154
SRI6031,"31 May 2022",2022,1,Demonstrations,Protests,"Peaceful protest","Protesters (Sri Lanka)","Women (Sri Lanka)",6,,,0,60,,144,"South Asia","Sri Lanka",Northern,Vavuniya,,Vavuniya,8.7514,80.4971,1,Virakesari,National,"On 31 May 2022, North Eastern Women's Union staged a protest in Vavuniya (Vavuniya, Northern) demanding justice for a nine year old girl who was killed by a man after trying to sexually abuse her.",0,"crowd size=no report",1680035154
SRI6033,"31 May 2022",2022,1,Demonstrations,Protests,"Peaceful protest","Protesters (Sri Lanka)","Women (Sri Lanka)",6,,,0,60,,144,"South Asia","Sri Lanka",Northern,Kilinochchi,,Kilinochchi,9.3961,80.3982,1,Virakesari,National,"On 31 May 2022, North Eastern Women's Union staged a protest in Kilinochchi (Kilinochchi, Northern) demanding justice for a nine year old girl who was killed by a man after trying to sexually abuse her.",0,"crowd size=no report",1707858547
SRI6028,"31 May 2022",2022,1,Demonstrations,Protests,"Peaceful protest","Protesters (Sri Lanka)",,6,,,0,60,,144,"South Asia","Sri Lanka",Western,Colombo,,Colombo,6.9319,79.8478,1,"Hiru News",National,"On 31 May 2022, people staging a protest demanding a solution to the current economic crisis at Galle Face in Colombo city, were joined by a social media activist (Colombo, Western). This is the 53rd day they have been protesting. The activists was released following his arrest earlier in connection with the unrest that took place on 9 May.",0,"crowd size=no report",1714518557
SRI6027,"30 May 2022",2022,1,Demonstrations,Protests,"Peaceful protest","Protesters (Sri Lanka)","Tamil Ethnic Group (Sri Lanka)",6,,,0,60,,144,"South Asia","Sri Lanka",Northern,Mullaitivu,,Mullaitivu,9.268,80.815,1,Virakesari,National,"On 30 May 2022, Tamil people staged a protest in Mullaitivu (Mullaitivu, Northern) demanding justice for people that disappeared during the civil war.",0,"crowd size=no report",1680035154
SRI6026,"30 May 2022",2022,1,Demonstrations,Protests,"Peaceful protest","Protesters (Sri Lanka)","Tamil Ethnic Group (Sri Lanka)",6,,,0,60,,144,"South Asia","Sri Lanka",Northern,Vavuniya,,Vavuniya,8.7514,80.4971,1,Virakesari,National,"On 30 May 2022, Tamil people staged a protest in Vavuniya (Vavuniya, Northern) demanding justice for people that disappeared during the civil war.",0,"crowd size=no report",1680035154
SRI6024,"30 May 2022",2022,1,Demonstrations,Protests,"Peaceful protest","Protesters (Sri Lanka)","Labor Group (Sri Lanka)",6,,,0,60,,144,"South Asia","Sri Lanka","North Western",Puttalam,,Puttalam,8.0362,79.8283,1,Virakesari,National,"On 30 May 2022, workers of Puttalam Palavi Saltworks staged a protest in Puttalam (Puttalam, North Western) demanding higher salaries due to the increase of commodities amid the current economic crisis.",0,"crowd size=no report",1680633904
SRI6025,"30 May 2022",2022,1,Demonstrations,Protests,"Peaceful protest","Protesters (Sri Lanka)",,6,,,0,60,,144,"South Asia","Sri Lanka",Western,Colombo,,Colombo,6.9319,79.8478,1,Virakesari,National,"On 30 May 2022, people staged a protest in Colombo (Colombo, Western) in front of the Indian High Commission demanding the release of a Kashmiri human rights activist.",0,"crowd size=no report",1714518557
SRI6023,"29 May 2022",2022,1,Demonstrations,Protests,"Peaceful protest","Protesters (Sri Lanka)",,6,,,0,60,,144,"South Asia","Sri Lanka",Western,Colombo,,Kollupitiya,6.9097,79.8507,1,"Hiru News",National,"On 29 May 2022, people staged a protest near the Temple Trees, the official residence of the Prime Minister in Kollupitiya (Kollupitiya, Western) over the current economic crisis.",0,"crowd size=no report",1719352734
SRI6042,"28 May 2022",2022,1,Demonstrations,Protests,"Protest with intervention","Protesters (Sri Lanka)","Health Workers (Sri Lanka); Students (Sri Lanka)",6,"Police Forces of Sri Lanka (2019-)",,1,16,,144,"South Asia","Sri Lanka",Western,Colombo,,Colombo,6.9319,79.8478,2,"Al Jazeera; Hiru News",National-International,"On 28 May 2022, police intervened and used tear gas, and water cannon to disperse thousands of protesters including medical students who marched from Kollupitiya to Lotus Roundabout in Colombo city (Western) demanding the resignation of the government and a solution to the current economic crisis. The protesters were marking 50 days of continuous protest and were trying to storm the president's official residence.",0,"crowd size=thousands",1714518557
SRI5996,"27 May 2022",2022,2,"Strategic developments","Strategic developments",Arrests,"Police Forces of Sri Lanka (2019-)",,1,"Civilians (Sri Lanka)",,7,17,,144,"South Asia","Sri Lanka",Western,Colombo,,Colombo,6.9319,79.8478,3,Virakesari,National,"Around 27 May 2022 (week of), police arrested 907 people from across the country (coded as Colombo, Western) in connection with the unrest over the ongoing economic crisis on 9 May 2022.",0,,1714518557
SRI6901,"26 May 2022",2022,1,"Strategic developments","Strategic developments",Arrests,"Police Forces of Sri Lanka (2019-)",,1,"Civilians (Sri Lanka)","Buddhist Group (Sri Lanka)",7,17,,144,"South Asia","Sri Lanka",Southern,Hambantota,,Weeraketiya,6.151,80.7643,1,ProtectDefenders.eu,"Local partner-Other","On 26 May 2022, a prominent human rights activist and Buddhist priest was arrested by Sri Lankan police in Weeraketiya (Hambantota, Southern) linked to violence that took place on or around 9 May 2022. Human rights organisations claim this is a false arrest.",0,,1683048359
SRI6020,"26 May 2022",2022,1,Demonstrations,Protests,"Peaceful protest","Protesters (Sri Lanka)",,6,,,0,60,,144,"South Asia","Sri Lanka",Western,Colombo,,Colombo,6.9319,79.8478,1,"Hiru News",National,"On 26 May 2022, people staged a protest rally in Colombo (Colombo, Western) against the appointment of the new Prime Minister. The protest was held under the theme 'No Deal Gama' to express their discontent with the new Prime Minister's appointment.",0,"crowd size=no report",1714518557
SRI6021,"26 May 2022",2022,1,Demonstrations,Protests,"Peaceful protest","Protesters (Sri Lanka)",,6,,,0,60,,144,"South Asia","Sri Lanka",Western,Colombo,,Colombo,6.9319,79.8478,1,"News1st (Sri Lanka)",National,"On 26 May 2022, protesters leading the anti-government movement 'GotaGoGama' staged a protest in Colombo (Colombo, Western) demanding a solution to the current economic crisis. It was the 48th day they have been continuing protests demanding the resignation of the government.",0,"crowd size=no report",1714518557
SRI6002,"26 May 2022",2022,1,Demonstrations,Protests,"Peaceful protest","Protesters (Sri Lanka)","Labor Group (Sri Lanka)",6,,,0,60,,144,"South Asia","Sri Lanka",Western,Colombo,,Borella,6.9177,79.8742,1,"News1st (Sri Lanka)",National,"On 26 May 2022, staff of Government Printing staged a protest in Borella (Borella, Western) over low wages amid the current economic crisis.",0,"crowd size=no report",1719352735
SRI6018,"25 May 2022",2022,1,Demonstrations,Protests,"Peaceful protest","Protesters (Sri Lanka)",,6,,,0,60,,144,"South Asia","Sri Lanka",Western,Colombo,,Colombo,6.9319,79.8478,1,"News1st (Sri Lanka)",National,"On 25 May 2022, protesters leading the anti-government movement 'GotaGoGama' staged a protest in Colombo (Colombo, Western) demanding a solution to the current economic crisis.",0,"crowd size=no report",1714518557
SRI6019,"25 May 2022",2022,1,Demonstrations,Protests,"Peaceful protest","Protesters (Sri Lanka)",,6,,,0,60,,144,"South Asia","Sri Lanka",Western,Colombo,,Colombo,6.9319,79.8478,1,Thinakkural,National,"On 25 May 2022, people protested in front of the Fort Magistrate Court in Colombo (Colombo, Western) demanding the arrest of those involved in the events of 9 May 2022 during which supporters of the government attacked anti-government protesters demanding resignation of the president in Colombo .",0,"crowd size=no report",1714518557
SRI6016,"24 May 2022",2022,1,Demonstrations,Protests,"Peaceful protest","Protesters (Sri Lanka)",,6,,,0,60,,144,"South Asia","Sri Lanka",Northern,Jaffna,,Jaffna,9.6685,80.0074,1,Virakesari,National,"On 24 May 2022, people staged a protest in Jaffna (Jaffna, Northern) demanding gas amid the current economic crisis. Protesters alleged that there was gas stored in the petrol stations but it was not released to the public. The police attended the scene and discovered that there was no fuel stored.",0,"crowd size=no report",1680633904
SRI6001,"24 May 2022",2022,1,Demonstrations,Protests,"Peaceful protest","Protesters (Sri Lanka)","Labor Group (Sri Lanka)",6,,,0,60,,144,"South Asia","Sri Lanka",Western,Colombo,,Colombo,6.9319,79.8478,1,"News1st (Sri Lanka)",National,"On 24 May 2022, worker of small power plants staged a protest in Colombo (Colombo, Western) in front of the Ceylon Electricity Board over non-payment of money owed by the Board to small power plants.",0,"crowd size=no report",1714518557
SRI6017,"24 May 2022",2022,1,Demonstrations,Protests,"Peaceful protest","Protesters (Sri Lanka)",,6,,,0,60,,144,"South Asia","Sri Lanka",Western,Colombo,,Colombo,6.9319,79.8478,1,"Ada Derana",National,"On 24 May 2022, people staged a protest in front of the Police Criminal Investigation Department (CID) in Colombo (Colombo, Western) demanding the arrest of an MP that was summoned for questioning over the events on 9 May 2022 during which violence broke out across the country over the economic crisis. The protesters were gathered outside CID while the police was interviewing the MP.",0,"crowd size=no report",1714518557
SRI6000,"23 May 2022",2022,1,Demonstrations,Protests,"Peaceful protest","Protesters (Sri Lanka)","Health Workers (Sri Lanka); Labor Group (Sri Lanka)",6,,,0,60,,144,"South Asia","Sri Lanka",Central,"Nuwara Eliya",,"Nuwara Eliya",6.9707,80.7828,1,Virakesari,National,"On 23 May 2022, health workers of Nuwara Eliya District General Hospital staged a protest in Nuwara Eliya (Nuwara Elya, Central) demanding the elimination of family rule in the country and to increase funding for the health sector. Doctors, nurses, and other hospital staff took part in the protest.",0,"crowd size=no report",1680035153
SRI5997,"22 May 2022",2022,1,"Political violence",Riots,"Mob violence","Rioters (Sri Lanka)","Labor Group (Sri Lanka)",5,"Rioters (Sri Lanka)","Labor Group (Sri Lanka)",5,55,,144,"South Asia","Sri Lanka",Uva,Badulla,,Badulla,6.9895,81.0557,1,Virakesari,National,"On 22 May 2022, a clash broke out between two groups of people queuing to refuel vehicles at a petrol station in Badulla (Badulla, Uva), amid the current economic crisis. During the clash, an angry bus driver stabbed and injured another bus driver when the latter cut the queue at the petrol station. 1 injured.",0,"crowd size=no report",1680035154
SRI5999,"22 May 2022",2022,1,"Political violence",Riots,"Mob violence","Rioters (Sri Lanka)",,5,,,0,50,,144,"South Asia","Sri Lanka","North Central",Anuradhapura,,Ipalogama,8.0969,80.507,1,"Hiru News",National,"On 22 May 2022, angry residents set fire to a building where the owner of a gas station was staying in Ipalogama (Ipolagama, North Central) over fuel shortages amid the current economic crisis.",0,"crowd size=no report",1680035157
SRI6015,"22 May 2022",2022,1,Demonstrations,Protests,"Peaceful protest","Protesters (Sri Lanka)",,6,,,0,60,,144,"South Asia","Sri Lanka",Central,Kandy,,Getambe,7.2691,80.6041,1,"Hiru News",National,"On 22 May 2022, people staged a protest in Getambe (Getambe, Central) demanding fuel amid the current economic crisis. The protesters blocked the Kandy-Colombo road in protest.",0,"crowd size=no report",1680633903
SRI6010,"21 May 2022",2022,1,Demonstrations,Protests,"Peaceful protest","Protesters (Sri Lanka)",,6,,,0,60,,144,"South Asia","Sri Lanka",Western,Gampaha,,Negombo,7.2168,79.8675,1,"Hiru News",National,"On 21 May 2022, people staged a protest at Thelwatta Junction in Negombo (Negombo, Western) demanding fuel amid the current economic crisis. They blocked entry to a fuel truck in protest.",0,"crowd size=no report",1680633903
SRI6007,"21 May 2022",2022,1,Demonstrations,Protests,"Peaceful protest","Protesters (Sri Lanka)",,6,,,0,60,,144,"South Asia","Sri Lanka",Southern,Matara,,Weligama,5.975,80.4296,1,"Hiru News",National,"On 21 May 2022, people staged a protest in Weligama (Weligama, Southern) demanding fuel amid the current economic crisis. Protesters blocked a fuel truck carrying diesel from entering Weligama gas station demanding petrol.",0,"crowd size=no report",1680633903
SRI6008,"21 May 2022",2022,1,Demonstrations,Protests,"Peaceful protest","Protesters (Sri Lanka)",,6,,,0,60,,144,"South Asia","Sri Lanka",Western,Gampaha,,Bopitiya,7.0709,79.8643,1,"Hiru News",National,"On 21 May 2022, people staged a protest in Bopitiya (Bopitiya, Western) and blocked the Ja-Ela-Negombo road demanding fuel amid the current economic crisis.",0,"crowd size=no report",1680633903
SRI6006,"21 May 2022",2022,1,Demonstrations,Protests,"Peaceful protest","Protesters (Sri Lanka)",,6,,,0,60,,144,"South Asia","Sri Lanka",Southern,Galle,,Galle,6.0367,80.217,2,"Hiru News",National,"On 21 May 2022, people staged a protest in Galle-Devata area near Galle (Galle, Southern) demanding fuel amid the current economic crisis.",0,"crowd size=no report",1680633903
SRI6013,"21 May 2022",2022,1,Demonstrations,Protests,"Peaceful protest","Protesters (Sri Lanka)",,6,,,0,60,,144,"South Asia","Sri Lanka",Western,Colombo,,Piliyandala,6.7999,79.9249,2,"Hiru News",National,"On 21 May 2022, people staged a protest near Piliyandala (Piliyandala, Western) demanding fuel and blocked the Colombo-Horana road amid the current economic crisis.",0,"crowd size=no report",1680633903
SRI6005,"21 May 2022",2022,1,Demonstrations,Protests,"Peaceful protest","Protesters (Sri Lanka)",,6,,,0,60,,144,"South Asia","Sri Lanka",Sabaragamuwa,Kegalle,,Warakapola,7.2226,80.1887,1,"News1st (Sri Lanka)",National,"On 21 May 2022, people staged a protest in Warakapola (Warakapola, Sabaragamuwa) demanding fuel amid the current economic crisis.",0,"crowd size=no report",1680633903
SRI6004,"21 May 2022",2022,1,Demonstrations,Protests,"Peaceful protest","Protesters (Sri Lanka)",,6,,,0,60,,144,"South Asia","Sri Lanka",Sabaragamuwa,Kegalle,,Mawanella,7.2519,80.4453,1,"News1st (Sri Lanka)",National,"On 21 May 2022, people staged a protest in Mawanella (Mawanella, Sabaragamuwa) demanding fuel amid the current economic crisis.",0,"crowd size=no report",1680633903
SRI6014,"21 May 2022",2022,1,Demonstrations,Protests,"Peaceful protest","Protesters (Sri Lanka)",,6,,,0,60,,144,"South Asia","Sri Lanka",Western,Gampaha,,Yakkala,7.0869,80.0271,1,"News1st (Sri Lanka)",National,"On 21 May 2022, people staged a protest in Yakkala (Yakkala, Western) demanding fuel amid the current economic crisis.",0,"crowd size=no report",1680633903
SRI6003,"21 May 2022",2022,1,Demonstrations,Protests,"Peaceful protest","Protesters (Sri Lanka)",,6,,,0,60,,144,"South Asia","Sri Lanka",Sabaragamuwa,Ratnapura,,Balangoda,6.6466,80.7007,1,"Hiru News",National,"On 21 May 2022, people staged a protest in Balandoda (Balangoda, Sabaragamuwa) demanding fuel amid the current economic crisis.",0,"crowd size=no report",1714518557
SRI6022,"21 May 2022",2022,1,Demonstrations,Protests,"Protest with intervention","Protesters (Sri Lanka)","Students (Sri Lanka)",6,"Police Forces of Sri Lanka (2019-)",,1,16,,144,"South Asia","Sri Lanka",Western,Colombo,,Colombo,6.9319,79.8478,1,"Hiru News",National,"On 21 May 2022, police intervened in a protest held in Colombo (Colombo) by students against the government. The police used water canons and tear gas to disperse the protesters. It is unclear what the protesters demanded.",0,"crowd size=no report",1714518557
SRI6012,"21 May 2022",2022,1,Demonstrations,Protests,"Peaceful protest","Protesters (Sri Lanka)",,6,,,0,60,,144,"South Asia","Sri Lanka",Western,Colombo,,Orugodawatta,6.9453,79.8814,1,"Hiru News",National,"On 21 May 2022, people staged a protest in Orugodawatta (Orugodawatta, Western) demanding fuel amid the current economic crisis.",0,"crowd size=no report",1714572605
SRI6011,"21 May 2022",2022,1,Demonstrations,Protests,"Peaceful protest","Protesters (Sri Lanka)",,6,,,0,60,,144,"South Asia","Sri Lanka",Western,Colombo,,Nugegoda,6.8735,79.8899,2,"Hiru News",National,"On 21 May 2022, people staged a protest near the Nugegoga-Nawala fuel station near Nugegoda (Nugegoda, Western) demanding fuel amid the current economic crisis.",0,"crowd size=no report",1719352735
SRI6009,"21 May 2022",2022,1,Demonstrations,Protests,"Peaceful protest","Protesters (Sri Lanka)",,6,,,0,60,,144,"South Asia","Sri Lanka",Western,Colombo,,Borella,6.9177,79.8742,2,"Hiru News",National,"On 21 May 2022, people staged a protest near Borella (Borella, Western) on the Borella-Narahenpita road demanding fuel amid the current economic crisis.",0,"crowd size=no report",1719352735
SRI5998,"20 May 2022",2022,1,"Political violence",Riots,"Mob violence","Rioters (Sri Lanka)",,5,"Rioters (Sri Lanka)",,5,55,,144,"South Asia","Sri Lanka",Eastern,Trincomalee,,Trincomalee,8.5711,81.2335,1,"Hiru News",National,"On 20 May 2022, two groups of people clashed with each other at the Trincomalee petrol station in Trincomalee (Trincomalee, Eastern). Both sides were there to get fuel. Police brought the situation under control.",0,"crowd size=no report",1680035153
SRI5973,"20 May 2022",2022,1,Demonstrations,Protests,"Peaceful protest","Protesters (Sri Lanka)","TUCC: Trade Union Coordinating Centre; Labor Group (Sri Lanka)",6,,,0,60,,144,"South Asia","Sri Lanka",Southern,Matara,,Matara,5.9485,80.5353,1,"News1st (Sri Lanka)",National,"On 20 May 2022, the Trade Union Coordinating Centre staged a protest in Matara (Matara, Southern) in front of the Matara Hospital, demanding the resignation of the President and the new Prime Minister over the lack of fuel, medicine, and gas amid the current economic crisis. They also demanded the arrest of government supporters who attacked people that were protesting at Myna Go Gama and Gota Go Gama protest sites in Colombo on 9 May.",0,"crowd size=no report",1680633903
SRI5969,"20 May 2022",2022,1,Demonstrations,Protests,"Peaceful protest","Protesters (Sri Lanka)","Labor Group (Sri Lanka)",6,,,0,60,,144,"South Asia","Sri Lanka",Western,Gampaha,,Katunayake,7.1699,79.8884,1,"News1st (Sri Lanka)",National,"On 20 May 2022, members of the Inter Company Employees Union - Sri Lankan Airlines Branch staged a protest in Katunayake (Katunayake, Gampaha, Western), against the new Prime Minister and over plans to sell public property and get more loans amid the current economic crisis, which they believe would require imposing more tax on the people.",0,"crowd size=no report",1680633903
SRI5994,"20 May 2022",2022,1,Demonstrations,Protests,"Protest with intervention","Protesters (Sri Lanka)",,6,"Police Forces of Sri Lanka (2019-)",,1,16,,144,"South Asia","Sri Lanka",Northern,Vavuniya,,Vavuniya,8.7514,80.4971,1,Virakesari,National,"On 20 May 2022, police intervened and dispersed a group of people who staged a protest in Vavuniya (Vavuniya, Northern) and blocked a main road in the city demanding cooking gas amid the current economic crisis.",0,"crowd size=no report",1680633904
SRI5967,"20 May 2022",2022,2,"Strategic developments","Strategic developments",Arrests,"Police Forces of Sri Lanka (2019-)",,1,"Civilians (Sri Lanka)",,7,17,,144,"South Asia","Sri Lanka",Western,Colombo,,Colombo,6.9319,79.8478,3,Virakesari,National,"Around 20 May 2022 (week of), police arrested 1059 people from across the country (coded as Colombo, Western) in connection with the violence over the ongoing economic crisis on 9 May 2022.",0,,1714518557
SRI5991,"20 May 2022",2022,1,Demonstrations,Protests,"Peaceful protest","Protesters (Sri Lanka)",,6,,,0,60,,144,"South Asia","Sri Lanka",Western,Colombo,,"Dehiwala-Mount Lavinia",6.8402,79.8712,1,"News1st (Sri Lanka)",National,"On 20 May 2022, people staged a protest in Dehiwala-Mount Lavinia (Dehiwala-Mount Lavinia, Colombo, Western) demanding cooking gas amid the current economic crisis.",0,"crowd size=no report",1719352735
SRI5992,"19 May 2022",2022,1,Demonstrations,Protests,"Peaceful protest","Protesters (Sri Lanka)",,6,,,0,60,,144,"South Asia","Sri Lanka",Western,Kalutara,,Horana,6.7159,80.0626,1,"News1st (Sri Lanka)",National,"On 19 May 2022, people staged a protest in Horana (Horana, Kalutara, Western) demanding fuel amid the current economic crisis.",0,"crowd size=no report",1680633903
SRI5966,"19 May 2022",2022,1,"Strategic developments","Strategic developments",Arrests,"Police Forces of Sri Lanka (2019-)",,1,"Civilians (Sri Lanka)",,7,17,,144,"South Asia","Sri Lanka",Western,Colombo,,Colombo,6.9319,79.8478,3,Virakesari,National,"On 19 May 2022, police arrested 161 people from across the country (coded as Colombo, Western) in connection with the violence over the ongoing economic crisis on 9 May 2022.",0,,1714518557
SRI5968,"19 May 2022",2022,1,Demonstrations,Protests,"Peaceful protest","Protesters (Sri Lanka)","Labor Group (Sri Lanka)",6,,,0,60,,144,"South Asia","Sri Lanka",Western,Colombo,,Colombo,6.9319,79.8478,1,Lankadeepa,National,"On 19 May 2022, a coalition of trade unions staged a protest in Colombo (Colombo, Western) against the plans to sell public property to resolve the current economic crisis. They also demanded the arrest of people involved in the May 9 attack, where supporters of the government attacked peaceful protesters in Galle Face that were staging a protest over the current economic crisis.",0,"crowd size=no report",1714518557
SRI5993,"19 May 2022",2022,1,Demonstrations,Protests,"Protest with intervention","Protesters (Sri Lanka)","Students (Sri Lanka)",6,"Police Forces of Sri Lanka (2019-)",,1,16,,144,"South Asia","Sri Lanka",Western,Colombo,,Colombo,6.9319,79.8478,1,Virakesari,National,"On 19 May 2022, the police used tear gas and water canons to disperse the All University Student Union's protest in Colombo (Colombo, Western). The students were demanding the resignation of the President and the government over the current economic crisis. The protest was held under the theme 'Kota - We will defeat the Ranil manoeuvring government - We will bring down this system'.",0,"crowd size=no report",1714518557
SRI5985,"19 May 2022",2022,1,Demonstrations,Protests,"Peaceful protest","Protesters (Sri Lanka)",,6,,,0,60,,144,"South Asia","Sri Lanka",Western,Colombo,,Bokundara,6.8168,79.9207,1,Lankadeepa,National,"On 19 May 2022, people staged a protest in Bokundara (Colombo, Western) and blocked the Colombo-Horana road, demanding fuel amid the current economic crisis.",0,"crowd size=no report",1719352735
SRI5986,"19 May 2022",2022,1,Demonstrations,Protests,"Peaceful protest","Protesters (Sri Lanka)",,6,,,0,60,,144,"South Asia","Sri Lanka",Western,Colombo,,Thalawathugoda,6.876,79.9388,1,Lankadeepa,National,"On 19 May 2022, people staged a protest in Thalawathugoda (Thalawathugoda, Western) and blocked the Kotte road, demanding fuel amid the current economic crisis.",0,"crowd size=no report",1719352735
SRI5984,"19 May 2022",2022,1,Demonstrations,Protests,"Peaceful protest","Protesters (Sri Lanka)",,6,,,0,60,,144,"South Asia","Sri Lanka",Western,Colombo,,"Dehiwala-Mount Lavinia",6.8402,79.8712,1,Lankadeepa,National,"On 19 May 2022, people staged a protest and blocked the Galle Road in Dehiwala-Mount Lavinia (Colombo, Western) demanding fuel amid the current economic crisis.",0,"crowd size=no report",1719352735
SRI5980,"18 May 2022",2022,1,Demonstrations,Protests,"Peaceful protest","Protesters (Sri Lanka)",,6,,,0,60,,144,"South Asia","Sri Lanka",Western,Gampaha,,Negombo,7.2168,79.8675,1,Lankadeepa,National,"On 18 May 2022, people staged a protest in Negombo (Gampaha, Western) and blocked the Negombo Road demanding fuel amid the current economic crisis.",0,"crowd size=no report",1680633903
SRI5983,"18 May 2022",2022,1,Demonstrations,Protests,"Peaceful protest","Protesters (Sri Lanka)",,6,,,0,60,,144,"South Asia","Sri Lanka",Western,Colombo,,Kesbewa,6.7914,79.9378,1,Lankadeepa,National,"On 18 May 2022, people staged a protest in Kesbewa (Colombo, Western) demanding petrol amid the current economic crisis.",0,"crowd size=no report",1680633903
SRI5990,"18 May 2022",2022,1,Demonstrations,Protests,"Peaceful protest","Protesters (Sri Lanka)",,6,,,0,60,,144,"South Asia","Sri Lanka",Western,Colombo,,Colombo,6.9319,79.8478,1,"News1st (Sri Lanka)",National,"On 18 May 2022, people staged a protest in the protest site 'Gota Go Gama' at Galle Face in Colombo (Colombo, Western), demanding the resignation of the President and the government over the current economic crisis. It was the 40th day they have been protesting at the site.",0,"crowd size=no report",1714518557
SRI5982,"18 May 2022",2022,1,Demonstrations,Protests,"Peaceful protest","Protesters (Sri Lanka)",,6,,,0,60,,144,"South Asia","Sri Lanka",Western,Colombo,,Wellawatte,6.8757,79.8596,1,Lankadeepa,National,"On 18 May 2022, people staged a protest in Wellawatte (Colombo, Western) demanding kerosine amid the current economic crisis.",0,"crowd size=no report",1719352735
