event_id_cnty,event_date,year,time_precision,disorder_type,event_type,sub_event_type,actor1,assoc_actor_1,inter1,actor2,assoc_actor_2,inter2,interaction,civilian_targeting,iso,region,country,admin1,admin2,admin3,location,latitude,longitude,geo_precision,source,source_scale,notes,fatalities,tags,timestamp
SRI5783,"20 April 2022",2022,1,Demonstrations,Protests,"Peaceful protest","Protesters (Sri Lanka)",,6,,,0,60,,144,"South Asia","Sri Lanka",Southern,Galle,,Balapitiya,6.278,80.0366,1,Lankadeepa,National,"On 20 April 2022, people staged a protest in Balapitiya (Balapitiya, Southern) over the current economic crisis.",0,"crowd size=no report",1680633903
SRI5786,"20 April 2022",2022,1,Demonstrations,Protests,"Peaceful protest","Protesters (Sri Lanka)",,6,,,0,60,,144,"South Asia","Sri Lanka",Southern,Galle,,Hikkaduwa,6.1407,80.1012,1,Lankadeepa,National,"On 20 April 2022, people staged a protest in Hikkaduwa (Hikkaduwa, Southern) over the current economic crisis.",0,"crowd size=no report",1680633903
SRI5810,"20 April 2022",2022,1,Demonstrations,Protests,"Protest with intervention","Protesters (Sri Lanka)","Labor Group (Sri Lanka)",6,"Rioters (Sri Lanka)",,5,56,,144,"South Asia","Sri Lanka",Western,Kalutara,,Panadura,6.7132,79.9026,1,Lankadeepa,National,"On 20 April 2022, local residents intervened and chased away a group of people including three-wheeler drivers who staged a protest in Panadura (Panadura, Western) over the current economic crisis.",0,"crowd size=no report",1680633903
SRI5784,"20 April 2022",2022,1,Demonstrations,Protests,"Peaceful protest","Protesters (Sri Lanka)",,6,,,0,60,,144,"South Asia","Sri Lanka",Southern,Galle,,Ambalangoda,6.2355,80.0538,1,Lankadeepa,National,"On 20 April 2022, people staged a protest in Ambalangoda (Galle, Southern) over the current economic crisis.",0,"crowd size=no report",1680633903
SRI5761,"20 April 2022",2022,1,Demonstrations,Protests,"Peaceful protest","Protesters (Sri Lanka)",,6,,,0,60,,144,"South Asia","Sri Lanka",Central,Matale,,Dambulla,7.86,80.6517,1,Virakesari,National,"On 20 April 2022, people staged a protest in Dambulla (Dambulla, Central) over the ongoing current economic crisis.",0,"crowd size=no report",1680633904
SRI5813,"20 April 2022",2022,1,Demonstrations,Riots,"Violent demonstration","Rioters (Sri Lanka)",,5,,,0,50,,144,"South Asia","Sri Lanka",Central,"Nuwara Eliya",,Hatton,6.8916,80.5955,1,Virakesari,National,"On 20 April 2022, people staged a demonstration and burned tires in Hatton (Hatton, Nuwara Eliya, Central) demanding the resignation of the government over the current economic crisis.",0,"crowd size=no report",1680633904
SRI5811,"20 April 2022",2022,1,Demonstrations,Protests,"Protest with intervention","Protesters (Sri Lanka)",,6,"Police Forces of Sri Lanka (2019-)",,1,16,,144,"South Asia","Sri Lanka",Central,"Nuwara Eliya",,"Nuwara Eliya",6.9707,80.7828,1,Virakesari,National,"On 20 April 2022, police used tear gas and dispersed a group of people who staged a protest in Nuwara Eliya (Nuwara Eliya, Central) over the current economic crisis.",0,"crowd size=no report",1680633904
SRI5759,"20 April 2022",2022,1,Demonstrations,Protests,"Peaceful protest","Protesters (Sri Lanka)",,6,,,0,60,,144,"South Asia","Sri Lanka",Central,"Nuwara Eliya",,Talawakelle,6.9355,80.6498,1,Virakesari,National,"On 20 April 2022, people staged a massive protest in Talawakelle (Nuwara Eliya, Central) demanding the government's resignation over the current economic crisis.",0,"crowd size=massive",1680633904
SRI5750,"20 April 2022",2022,1,Demonstrations,Protests,"Peaceful protest","Protesters (Sri Lanka)","Labor Group (Sri Lanka)",6,,,0,60,,144,"South Asia","Sri Lanka",Eastern,Batticaloa,,Batticaloa,7.7102,81.6924,1,Virakesari,National,"On 20 April 2022, more than 100 trade union members staged a protest in Batticaloa (Batticaloa, Eastern) over the current economic crisis.",0,"crowd size=more than 100",1680633904
SRI5763,"20 April 2022",2022,1,Demonstrations,Protests,"Peaceful protest","Protesters (Sri Lanka)",,6,,,0,60,,144,"South Asia","Sri Lanka",Uva,Badulla,,Welimada,6.9044,80.9044,1,Virakesari,National,"On 20 April 2022, people staged a protest in Welimada (Welimada, Uva), over the current economic crisis.",0,"crowd size=no report",1680633904
SRI5762,"20 April 2022",2022,1,Demonstrations,Protests,"Peaceful protest","Protesters (Sri Lanka)",,6,,,0,60,,144,"South Asia","Sri Lanka","North Western",Puttalam,,Puttalam,8.0362,79.8283,1,Virakesari,National,"On 20 April 2022, people staged a protest in Puttalam (Puttalam, North Western) over the current economic crisis.",0,"crowd size=no report",1680633904
SRI5760,"20 April 2022",2022,1,Demonstrations,Protests,"Peaceful protest","Protesters (Sri Lanka)",,6,,,0,60,,144,"South Asia","Sri Lanka",Southern,Hambantota,,Tangalle,6.024,80.7911,1,Virakesari,National,"On 20 April 2022, people staged a protest in Tangalle (Tangalle, Southern) against the ongoing economic crisis.",0,"crowd size=no report",1680633904
SRI5751,"20 April 2022",2022,1,Demonstrations,Protests,"Peaceful protest","Protesters (Sri Lanka)","Labor Group (Sri Lanka)",6,,,0,60,,144,"South Asia","Sri Lanka",Northern,Vavuniya,,Vavuniya,8.7514,80.4971,1,Virakesari,National,"On 20 April 2022, Bank of Ceylon employees staged a protest in Vavuniya (Vavuniya, Northern) against the fuel shortages and soaring living costs amid the ongoing economic crisis.",0,"crowd size=no report",1680633904
SRI5812,"20 April 2022",2022,1,Demonstrations,Protests,"Protest with intervention","Protesters (Sri Lanka)",,6,"Police Forces of Sri Lanka (2019-)",,1,16,,144,"South Asia","Sri Lanka",Southern,Matara,,Matara,5.9485,80.5353,1,Virakesari,National,"On 20 April 2022, police intervened and used tear gas to disperse a group of people who staged a protest in Matara (Matara, Southern) by blocking the main road of Mahanama. They were protesting over the current economic crisis. Eight people were injured.",0,"crowd size=no report",1680633904
SRI5747,"20 April 2022",2022,1,Demonstrations,Protests,"Peaceful protest","Protesters (Sri Lanka)","Fishers (Sri Lanka)",6,,,0,60,,144,"South Asia","Sri Lanka",Southern,Matara,,Matara,5.9485,80.5353,1,Virakesari,National,"On 20 April 2022, fishers staged a protest in Matara (Matara, Southern) and blocked the Tangalle main road over the increase in fuel price amid the ongoing economic crisis.",0,"crowd size=no report",1680633904
SRI5753,"20 April 2022",2022,1,Demonstrations,Protests,"Peaceful protest","Protesters (Sri Lanka)","Students (Sri Lanka)",6,,,0,60,,144,"South Asia","Sri Lanka",Western,Colombo,,Colombo,6.9319,79.8478,1,Virakesari,National,"On 20 April 2022, people staged a protest in Galle Face in Colombo (Colombo, Western) demanding the resignation of the President over the current economic crisis. A group of students marched and staged a separate protest in Colombo, demanding the President to step down over the current economic crisis.",0,"crowd size=no report",1714518556
SRI5785,"20 April 2022",2022,1,Demonstrations,Protests,"Peaceful protest","Protesters (Sri Lanka)",,6,,,0,60,,144,"South Asia","Sri Lanka",Western,Colombo,,"Battaramulla South",6.8964,79.9181,1,Lankadeepa,National,"On 20 April 2022, people staged a protest in Battaramulla South (Battaramulla South, Western) demanding justice for the victims of Rambukkana who protested over the current economic crisis.",0,"crowd size=no report",1714518556
SRI5814,"19 April 2022",2022,1,Demonstrations,Riots,"Violent demonstration","Rioters (Sri Lanka)",,5,"Police Forces of Sri Lanka (2019-)",,1,15,,144,"South Asia","Sri Lanka",Sabaragamuwa,Kegalle,,"Rambukkana Town",7.3208,80.4006,1,"Al Jazeera; Virakesari",National-International,"On 19 April 2022, police opened fire at a group of people demonstrating against the current economic crisis in Rambukkana Town (Rambukkana Town, Sabaragamuwa) leading to one fatality and injuries to 14 others. The demonstrators blocked a road by burning tyres during their demonstration prompting police to open fire at them. 15 policemen were also injured following a clash with the demonstrators.",1,"crowd size=no report",1680633903
SRI5782,"19 April 2022",2022,1,Demonstrations,Protests,"Peaceful protest","Protesters (Sri Lanka)",,6,,,0,60,,144,"South Asia","Sri Lanka",Southern,Matara,,Hakmana,6.0988,80.649,1,Lankadeepa,National,"On 19 April 2022, people staged a protest near the residence of the Secretary to the President in Hakmana (Hakmana, Southern) over the current economic crisis.",0,"crowd size=no report",1680633903
SRI5767,"19 April 2022",2022,1,Demonstrations,Protests,"Peaceful protest","Protesters (Sri Lanka)",,6,,,0,60,,144,"South Asia","Sri Lanka",Central,Kandy,,Gampola,7.1643,80.5696,1,Virakesari,National,"On 19 April 2022, people staged a protest in Gampola (Gampola, Central) over the increase in fuel prices due to the current economic crisis.",0,"crowd size=no report",1680633904
SRI5765,"19 April 2022",2022,1,Demonstrations,Protests,"Peaceful protest","Protesters (Sri Lanka)",,6,,,0,60,,144,"South Asia","Sri Lanka",Central,"Nuwara Eliya",,Hatton,6.8916,80.5955,1,Virakesari,National,"On 19 April 2022, people staged a protest in Hatton (Hatton, Central) after bus services were disrupted due to protests in various parts of the country amid the ongoing economic crisis.",0,"crowd size=no report",1680633904
SRI5766,"19 April 2022",2022,1,Demonstrations,Protests,"Peaceful protest","Protesters (Sri Lanka)",,6,,,0,60,,144,"South Asia","Sri Lanka",Central,"Nuwara Eliya",,Kotagala,6.9284,80.6061,1,Virakesari,National,"On 19 April 2022, people staged a protest in Kotagala (Kotagala, Central) over the current economic crisis.",0,"crowd size=no report",1680633904
SRI5764,"19 April 2022",2022,1,Demonstrations,Protests,"Peaceful protest","Protesters (Sri Lanka)",,6,,,0,60,,144,"South Asia","Sri Lanka",Eastern,Trincomalee,,Trincomalee,8.5711,81.2335,1,Virakesari,National,"On 19 April 2022, people staged a protest in Trincomalee (Trincomalee, Eastern) over the current economic crisis.",0,"crowd size=no report",1680633904
SRI5769,"19 April 2022",2022,1,Demonstrations,Protests,"Peaceful protest","Protesters (Sri Lanka)",,6,,,0,60,,144,"South Asia","Sri Lanka","North Central",Anuradhapura,,Anuradhapura,8.3123,80.4131,1,Virakesari,National,"On 19 April 2022, people staged a protest in Anuradhapura (Anuradhapura, North Central) over the increase in fuel prices amid the ongoing economic crisis.",0,"crowd size=no report",1680633904
SRI5771,"19 April 2022",2022,1,Demonstrations,Protests,"Peaceful protest","Protesters (Sri Lanka)",,6,,,0,60,,144,"South Asia","Sri Lanka","North Central",Polonnaruwa,,Hingurakgoda,8.053,80.9816,1,Virakesari,National,"On 19 April 2022, people staged a protest in Hingurakgoda (Hingurakgoda, North Central) over fuel shortages and increase in fuel prices amid the ongoing economic crisis.",0,"crowd size=no report",1680633904
SRI5777,"19 April 2022",2022,1,Demonstrations,Protests,"Peaceful protest","Protesters (Sri Lanka)",,6,,,0,60,,144,"South Asia","Sri Lanka","North Western",Puttalam,,Chilaw,7.5758,79.7953,2,Virakesari,National,"On 19 April 2022, people staged a protest near Chilaw (Chilaw, Puttalam) blocking the Chilaw-Colombo road over fuel shortages and increase in fuel prices amid the ongoing economic crisis.",0,"crowd size=no report",1680633904
SRI5770,"19 April 2022",2022,1,Demonstrations,Protests,"Peaceful protest","Protesters (Sri Lanka)",,6,,,0,60,,144,"South Asia","Sri Lanka",Western,Colombo,,Avissawella,6.953,80.2075,1,Virakesari,National,"On 19 April 2022, people staged a protest in Avissawella (Colombo, Western) over the increase in fuel prices and fuel shortages amid the ongoing economic crisis.",0,"crowd size=no report",1680633904
SRI5774,"19 April 2022",2022,1,Demonstrations,Protests,"Peaceful protest","Protesters (Sri Lanka)",,6,,,0,60,,144,"South Asia","Sri Lanka",Sabaragamuwa,Ratnapura,,Ratnapura,6.6828,80.3992,1,Virakesari,National,"On 19 April 2022, people staged a protest in Ratnapura (Ratnapura, Sabaragamuwa) over fuel shortages and increase in fuel prices amid the ongoing economic crisis.",0,"crowd size=no report",1680633904
SRI5776,"19 April 2022",2022,1,Demonstrations,Protests,"Peaceful protest","Protesters (Sri Lanka)",,6,,,0,60,,144,"South Asia","Sri Lanka",Southern,Galle,,Galle,6.0367,80.217,1,Virakesari,National,"On 19 April 2022, people staged a protest in Galle (Galle, Southern) over fuel shortages and increase in fuel prices amid the ongoing economic crisis.",0,"crowd size=no report",1680633904
SRI5752,"19 April 2022",2022,1,Demonstrations,Protests,"Peaceful protest","Protesters (Sri Lanka)","NPP: National People's Power",6,,,0,60,,144,"South Asia","Sri Lanka",Western,Kalutara,,Beruwala,6.4788,79.9828,1,Virakesari,National,"On 19 April 2022, supporters of the National People's Power staged a protest in Beruwala (Beruwala, Western), over the current economic crisis.",0,"crowd size=no report",1680633904
SRI5772,"19 April 2022",2022,1,Demonstrations,Protests,"Peaceful protest","Protesters (Sri Lanka)",,6,,,0,60,,144,"South Asia","Sri Lanka",Southern,Galle,,Baddegama,6.1601,80.2017,1,Virakesari,National,"On 19 April 2022, people staged a protest in Baddegama (Baddegama, Southern) over fuel shortages and increase in fuel prices amid the ongoing economic crisis.",0,"crowd size=no report",1680633904
SRI5768,"19 April 2022",2022,1,Demonstrations,Protests,"Peaceful protest","Protesters (Sri Lanka)",,6,,,0,60,,144,"South Asia","Sri Lanka",Central,Matale,,Matale,7.4698,80.6217,1,Virakesari,National,"On 19 April 2022, people staged a protest in Matale (Matale, Central) over the increase of fuel prices amid the ongoing economic crisis.",0,"crowd size=no report",1710874088
SRI5754,"19 April 2022",2022,1,Demonstrations,Protests,"Peaceful protest","Protesters (Sri Lanka)","Health Workers (Sri Lanka); Teachers (Sri Lanka)",6,,,0,60,,144,"South Asia","Sri Lanka",Western,Colombo,,Colombo,6.9319,79.8478,1,Virakesari,National,"On 19 April 2022, people staged a protest in Galle Face in Colombo (Colombo, Western) demanding the resignation of the President over the current economic crisis. A large number of lecturers of several universities marched and staged a separate protest in Colombo, against the current economic crisis. Health workers and doctors also staged a protest in Colombo, over medicine shortage amid the ongoing economic crisis.",0,"crowd size=no report",1714518556
SRI5773,"19 April 2022",2022,1,Demonstrations,Protests,"Peaceful protest","Protesters (Sri Lanka)",,6,,,0,60,,144,"South Asia","Sri Lanka",Central,Kandy,,Digana,7.3016,80.733,1,Virakesari,National,"On 19 April 2022, people staged a protest in Digana (Digana, Central) over fuel shortages and increase in fuel prices amid the ongoing economic crisis.",0,"crowd size=no report",1714518556
SRI5775,"19 April 2022",2022,1,Demonstrations,Protests,"Peaceful protest","Protesters (Sri Lanka)",,6,,,0,60,,144,"South Asia","Sri Lanka",Central,Kandy,,Teldeniya,7.2969,80.7686,1,Virakesari,National,"On 19 April 2022, people staged a protest in Teldeniya (Teldeniya, Central) over fuel shortages and increase in fuel prices amid the ongoing economic crisis.",0,"crowd size=no report",1714518556
SRI5815,"18 April 2022",2022,1,Demonstrations,Riots,"Violent demonstration","Rioters (Sri Lanka)",,5,"Civilians (Sri Lanka)",,7,57,,144,"South Asia","Sri Lanka","North Western",Kurunegala,,Kurunegala,7.4863,80.3623,1,Lankadeepa,National,"On 18 April 2022, people staged a violent demonstration in Kurunegala (Kurunegala, North Western) due to fuel shortages amid the ongoing economic crisis. The demonstrators damaged a car and attacked passengers inside after the driver confronted demonstrators when they did not let the car pass through.",0,"crowd size=no report",1680633903
SRI5778,"18 April 2022",2022,1,Demonstrations,Protests,"Peaceful protest","Protesters (Sri Lanka)",,6,,,0,60,,144,"South Asia","Sri Lanka",Central,"Nuwara Eliya",,Hatton,6.8916,80.5955,1,Virakesari,National,"On 18 April 2022, people staged a protest in Hatton Jasmine Junction (Hatton, Central) over the current economic crisis.",0,"crowd size=no report",1680633904
SRI5749,"18 April 2022",2022,1,Demonstrations,Protests,"Peaceful protest","Protesters (Sri Lanka)","Journalists (Sri Lanka)",6,,,0,60,,144,"South Asia","Sri Lanka",Western,Colombo,,Colombo,6.9319,79.8478,1,Lankadeepa,National,"On 18 April 2022, journalists staged a protest in Colombo (Colombo, Western) demanding protection for journalists amid the ongoing economic crisis.",0,"crowd size=no report",1714518556
SRI5789,"17 April 2022",2022,1,Demonstrations,Protests,"Peaceful protest","Protesters (Sri Lanka)",,6,,,0,60,,144,"South Asia","Sri Lanka","North Western",Kurunegala,,Kurunegala,7.4863,80.3623,1,"News1st (Sri Lanka)",National,"On 17 April 2022, people staged a protest in Kurunegala (Kurunegala, North Western), over the current economic crisis.",0,"crowd size=no report",1680633903
SRI5755,"17 April 2022",2022,1,Demonstrations,Protests,"Peaceful protest","Protesters (Sri Lanka)","TNA: Tamil National Alliance; Government of Sri Lanka (2019-)",6,,,0,60,,144,"South Asia","Sri Lanka",Northern,Jaffna,,Jaffna,9.6685,80.0074,1,Virakesari,National,"On 17 April 2022, supporters of the Tamil National Alliance, including MPs and politicians, staged a protest in Jaffna (Jaffna, Northern) demanding justice for the families of the people that disappeared. They also demanded the resignation of the President over the current economic crisis.",0,"crowd size=no report",1680633904
SRI6242,"17 April 2022",2022,1,Demonstrations,Protests,"Protest with intervention","Protesters (Sri Lanka)",,6,"Police Forces of Sri Lanka (2019-)",,1,16,,144,"South Asia","Sri Lanka",Southern,Galle,,Galle,6.0367,80.217,1,"News1st (Sri Lanka)",National,"On 17 April 2022, police intervened to a group of people staging a protest in Galle town (Galle Four Gravets, Southern), in support of the people protesting at Galle Face in Colombo against the government, and removed their tents.",0,"crowd size=no report",1680633905
SRI5779,"17 April 2022",2022,1,Demonstrations,Protests,"Peaceful protest","Protesters (Sri Lanka)",,6,,,0,60,,144,"South Asia","Sri Lanka",Western,Colombo,,Colombo,6.9319,79.8478,1,Virakesari,National,"On 17 April 2022, people staged a protest in Colombo (Colombo, Western) demanding justice for the victims of Easter Sunday attack.",0,"crowd size=no report",1714518556
SRI5780,"17 April 2022",2022,1,Demonstrations,Protests,"Peaceful protest","Protesters (Sri Lanka)",,6,,,0,60,,144,"South Asia","Sri Lanka",Western,Colombo,,Colombo,6.9319,79.8478,1,Virakesari,National,"On 17 April 2022, people staged a protest in Galle Face in Colombo (Colombo, Western) demanding the resignation of the President over the current economic crisis.",0,"crowd size=no report",1714518556
SRI5790,"17 April 2022",2022,1,Demonstrations,Protests,"Peaceful protest","Protesters (Sri Lanka)",,6,,,0,60,,144,"South Asia","Sri Lanka",Sabaragamuwa,Ratnapura,,Thumbagoda,6.6551,80.6988,1,"News1st (Sri Lanka)",National,"On 17 April 2022, people staged a protest in Thumbagoda (Thumbagoda, Sabaragamuwa) over the current economic crisis.",0,"crowd size=no report",1714518556
SRI5781,"16 April 2022",2022,1,Demonstrations,Protests,"Peaceful protest","Protesters (Sri Lanka)",,6,,,0,60,,144,"South Asia","Sri Lanka",Central,"Nuwara Eliya",,"Nuwara Eliya",6.9707,80.7828,1,Virakesari,National,"On 16 April 2022, people staged a protest in Nuwara Eliya (Nuwara Eliya, Central) over the current economic crisis.",0,"crowd size=no report",1680633904
SRI5798,"16 April 2022",2022,1,Demonstrations,Protests,"Peaceful protest","Protesters (Sri Lanka)",,6,,,0,60,,144,"South Asia","Sri Lanka",Southern,Matara,,Mirissa,5.9496,80.4593,1,"Hiru News",National,"On 16 April 2022, people staged a protest in Mirissa (Matara, Southern) over the current economic crisis.",0,"crowd size=no report",1705443136
SRI5788,"16 April 2022",2022,1,Demonstrations,Protests,"Peaceful protest","Protesters (Sri Lanka)",,6,,,0,60,,144,"South Asia","Sri Lanka",Western,Colombo,,Colombo,6.9319,79.8478,1,"News1st (Sri Lanka)",National,"On 16 April 2022, people staged a protest in Galle Face in Colombo (Colombo, Western) demanding the resignation of the President over the current economic crisis.",0,"crowd size=no report",1714518556
SRI5732,"15 April 2022",2022,1,Demonstrations,Protests,"Peaceful protest","Protesters (Sri Lanka)",,6,,,0,60,,144,"South Asia","Sri Lanka",Western,Colombo,,Colombo,6.9319,79.8478,1,Virakesari,National,"On 15 April 2022, tens of thousands of people demonstrated in Colombo (Western) against the government over the current economic crisis.",0,"crowd size=tens of thousands",1714518556
SRI5716,"14 April 2022",2022,1,Demonstrations,Protests,"Peaceful protest","Protesters (Sri Lanka)","Tamil Ethnic Group (Sri Lanka)",6,,,0,60,,144,"South Asia","Sri Lanka",Northern,Vavuniya,,Vavuniya,8.7514,80.4971,1,"Tamil Guardian",International,"On 14 April 2022, Tamil people staged a protest in Vavuniya (Vavuniya, Northern) demanding justice for the disappeared people.",0,"crowd size=no report",1680035150
SRI5731,"14 April 2022",2022,1,Demonstrations,Protests,"Peaceful protest","Protesters (Sri Lanka)",,6,,,0,60,,144,"South Asia","Sri Lanka",Western,Colombo,,Colombo,6.9319,79.8478,1,Virakesari,National,"On 14 April 2022, people staged a protest in Colombo (Colombo, Colombo, Colombo) over the current economic crisis.",0,"crowd size=no report",1714518556
SRI5745,"13 April 2022",2022,1,"Political violence; Demonstrations",Protests,"Excessive force against protesters","Protesters (Sri Lanka)","Students (Sri Lanka)",6,"Rioters (Sri Lanka)","Government of Sri Lanka (2019-); SLPP: Sri Lanka People's Front",5,56,"Civilian targeting",144,"South Asia","Sri Lanka",Western,Gampaha,,Makola,6.977,79.958,1,Virakesari,National,"On 13 April 2022, members of the student union of the University of Kelaniya staged protest at Makola (Biyagama, Gampaha, Western) against the government due to the current economic crisis. The protesters were attacked by government supporters led by a member of the Kelani Pradeshiya Sabha (legislative body that presides over the third tier municipalities) of SLPP. Many university students were injured and admitted to the hospital.",0,"crowd size=no report",1712183459
SRI5730,"13 April 2022",2022,1,Demonstrations,Protests,"Peaceful protest","Protesters (Sri Lanka)",,6,,,0,60,,144,"South Asia","Sri Lanka",Western,Colombo,,Colombo,6.9319,79.8478,1,Virakesari,National,"On 13 April 2022, people staged a protest in Colombo (Colombo, Colombo, Colombo) over the current economic crisis.",0,"crowd size=no report",1714518556
SRI5744,"12 April 2022",2022,1,Demonstrations,Protests,"Peaceful protest","Protesters (Sri Lanka)",,6,,,0,60,,144,"South Asia","Sri Lanka",Sabaragamuwa,Kegalle,,"Rambukkana Town",7.3208,80.4006,1,"Hiru News",National,"On 12 April 2022, people staged a protest in Rambukkana Town (Kegalle, Sabaragamuwa) over the current economic crisis.",0,"crowd size=no report",1680633903
SRI5743,"12 April 2022",2022,1,Demonstrations,Protests,"Peaceful protest","Protesters (Sri Lanka)",,6,,,0,60,,144,"South Asia","Sri Lanka",Uva,Badulla,,Meegahatenna,7.0112,81.0945,1,"Hiru News",National,"On 12 April 2022, people staged a protest in Meegahatenna (Badulla, Uva) over fuel shortages amid the current economic crisis.",0,"crowd size=no report",1680633903
SRI5741,"12 April 2022",2022,1,Demonstrations,Protests,"Peaceful protest","Protesters (Sri Lanka)",,6,,,0,60,,144,"South Asia","Sri Lanka",Eastern,Ampara,,Uhana,7.3667,81.6333,1,"Hiru News",National,"On 12 April 2022, people staged a protest in Uhana (Ampara, Eastern) against the government over the current economic crisis.",0,"crowd size=no report",1680633903
SRI5738,"12 April 2022",2022,1,Demonstrations,Protests,"Peaceful protest","Protesters (Sri Lanka)",,6,,,0,60,,144,"South Asia","Sri Lanka",Southern,Galle,,Benthota,6.4186,80.0062,1,Lankadeepa,National,"On 12 April 2022, nearly 500 people lined up at a petrol station in Bentota staged a protest in Benthota (Galle, Southern) over the lack of fuel due to the current economic crisis.",0,"crowd size=nearly 500",1680633903
SRI5715,"12 April 2022",2022,1,Demonstrations,Protests,"Peaceful protest","Protesters (Sri Lanka)","Tamil Ethnic Group (Sri Lanka)",6,,,0,60,,144,"South Asia","Sri Lanka",Northern,Vavuniya,,Vavuniya,8.7514,80.4971,1,"Tamil Guardian",International,"On 12 April 2022, Tamil people staged a protest in Vavuniya (Vavuniya South, Northern) against the Prevention of Terrorism Act and demanding the release of political prisoners and resignation of the president amid the current economic crisis.",0,"crowd size=no report",1680633903
SRI5709,"12 April 2022",2022,1,Demonstrations,Protests,"Peaceful protest","Protesters (Sri Lanka)","Buddhist Group (Sri Lanka)",6,,,0,60,,144,"South Asia","Sri Lanka",Western,Colombo,,Colombo,6.9319,79.8478,1,"Hiru News",National,"On 12 April 2022, a large number of people, including Buddhists, staged a protest in Colombo (Colombo, Western) demanding nobody touches a Buddhist statute in the area.",0,"crowd size=large",1714518556
SRI5722,"12 April 2022",2022,1,Demonstrations,Protests,"Peaceful protest","Protesters (Sri Lanka)",,6,,,0,60,,144,"South Asia","Sri Lanka",Western,Colombo,,Colombo,6.9319,79.8478,1,Virakesari,National,"On 12 April 2022, people demonstrated near the Presidential Secretariat in Colombo (Western) demanding the government's resignation due to the current economic crisis.",0,"crowd size=no report",1714518556
SRI5740,"12 April 2022",2022,1,Demonstrations,Protests,"Peaceful protest","Protesters (Sri Lanka)",,6,,,0,60,,144,"South Asia","Sri Lanka",Central,Kandy,,Digana,7.3016,80.733,1,"Hiru News",National,"On 12 April 2022, people staged a protest in Digana (Kandy, Central) against the government over the current economic crisis.",0,"crowd size=no report",1714518556
